{
  "$schema": "https://json-schema.org/draft/2020-12/schema",
  "$id": "https://archctx.repoharness.com/schemas/cloud/device-identity.schema.json",
  "title": "DeviceIdentity",
  "type": "object",
  "additionalProperties": false,
  "required": ["schemaVersion", "deviceId", "accountId", "publicKeyId", "publicKeyFingerprint", "status", "createdAt"],
  "properties": {
    "schemaVersion": { "const": "archcontext.device-identity/v1" },
    "deviceId": { "type": "string" },
    "accountId": { "type": "string" },
    "publicKeyId": { "type": "string" },
    "publicKeyFingerprint": { "type": "string", "pattern": "^sha256:[a-f0-9]{64}$" },
    "status": { "type": "string", "enum": ["active", "revoked"] },
    "createdAt": { "type": "string" },
    "revokedAt": { "type": ["string", "null"] }
  }
}
