{
  "schemaVersion": "archcontext.device-identity/v1",
  "deviceId": "device_0001",
  "accountId": "acct_0001",
  "publicKeyId": "key_device_0001",
  "publicKeyFingerprint": "sha256:8888888888888888888888888888888888888888888888888888888888888888",
  "status": "active",
  "createdAt": "2026-06-20T09:00:00Z",
  "revokedAt": null
}
